{
  "schema_version": "1.0",
  "plan_id": "plan-0123456789abcdef01234567",
  "operation": "install",
  "requested": ["firefox"],
  "catalog_fingerprint": "aaaaaaaaaaaaaaaaaaaaaaaaaaaaaaaaaaaaaaaaaaaaaaaaaaaaaaaaaaaaaaaa",
  "platform_fingerprint": "bbbbbbbbbbbbbbbbbbbbbbbbbbbbbbbbbbbbbbbbbbbbbbbbbbbbbbbbbbbbbbbb",
  "policy_fingerprint": "cccccccccccccccccccccccccccccccccccccccccccccccccccccccccccccccc",
  "created_at_unix": 1783897200,
  "reproducibility": "best_effort",
  "packages": [
    {
      "requested": "firefox",
      "logical_id": "firefox",
      "source_id": "firefox-apt",
      "backend": "apt",
      "native_id": "firefox",
      "current_version": null,
      "desired_version": null,
      "scope": "system",
      "channel": "stable",
      "architecture": "x86_64"
    }
  ],
  "steps": [
    {
      "id": "step-0001",
      "package": "firefox",
      "kind": "backend",
      "description": "delegate install to apt",
      "command": {
        "executable": "/usr/bin/apt-get",
        "arguments": ["install", "--yes", "--", "firefox"],
        "redacted_arguments": ["install", "--yes", "--", "firefox"],
        "timeout_seconds": 1800,
        "max_output_bytes": 1048576,
        "requires_privilege": true,
        "network": true,
        "environment": [["LANG", "C.UTF-8"], ["LC_ALL", "C.UTF-8"]]
      },
      "network_endpoints": ["apt repository (endpoint managed by backend)"],
      "expected_download_bytes": null,
      "verification_requirements": ["ubuntu-main", "https://packages.ubuntu.com/firefox"],
      "requires_privilege": true,
      "agreements": [],
      "destructive": false,
      "rollback_hint": "If safe, review a new `siorb plan remove firefox`."
    }
  ],
  "warnings": [],
  "conflicts": [],
  "recovery_guidance": [
    "Run `siorb reconcile` after interruption or partial completion.",
    "Native package managers may not support atomic rollback."
  ],
  "revalidation": {
    "platform_fingerprint": "bbbbbbbbbbbbbbbbbbbbbbbbbbbbbbbbbbbbbbbbbbbbbbbbbbbbbbbbbbbbbbbb",
    "catalog_fingerprint": "aaaaaaaaaaaaaaaaaaaaaaaaaaaaaaaaaaaaaaaaaaaaaaaaaaaaaaaaaaaaaaaa",
    "policy_fingerprint": "cccccccccccccccccccccccccccccccccccccccccccccccccccccccccccccccc",
    "installed_fingerprint": "dddddddddddddddddddddddddddddddddddddddddddddddddddddddddddddddd"
  }
}
